{
  "$schema": "https://json-schema.org/draft/2020-12/schema",
  "$id": "step5d.autotune-v4/r009-behavior-manifest-v1",
  "title": "Step5d Autotune V4 R009 behavior manifest",
  "type": "object",
  "additionalProperties": false,
  "required": [
    "schema",
    "version",
    "program",
    "lineage",
    "parent_r006_contract_sha256",
    "parent_r006_source_closure_sha256",
    "r009_source_closure_sha256",
    "source_closure",
    "contact_search_schedule",
    "raw_codec",
    "objective_semantic_fingerprint",
    "runtime_protocol",
    "executable_behavior_config"
  ],
  "properties": {
    "schema": {"const": "step5d.autotune-v4/r009-behavior-manifest-v1"},
    "version": {"const": "r009-v1"},
    "program": {"const": "step5d_strict_rnn_autotune_v4_r009"},
    "lineage": {"const": "step5d_strict_rnn_autotune_v4"},
    "parent_r006_contract_sha256": {"type": "string", "pattern": "^[0-9a-f]{64}$"},
    "parent_r006_source_closure_sha256": {"type": "string", "pattern": "^[0-9a-f]{64}$"},
    "r009_source_closure_sha256": {"type": "string", "pattern": "^[0-9a-f]{64}$"},
    "source_closure": {
      "type": "object",
      "additionalProperties": false,
      "required": ["schema", "files", "sha256"],
      "properties": {
        "schema": {"const": "step5d.autotune-v4/r009-source-set-v1"},
        "files": {"type": "object", "minProperties": 1, "additionalProperties": {"type": "string", "pattern": "^[0-9a-f]{64}$"}},
        "sha256": {"type": "string", "pattern": "^[0-9a-f]{64}$"}
      }
    },
    "contact_search_schedule": {"type": "object", "minProperties": 1},
    "raw_codec": {"type": "string", "minLength": 1},
    "objective_semantic_fingerprint": {"type": "string", "minLength": 1},
    "runtime_protocol": {"type": "integer", "minimum": 1},
    "executable_behavior_config": {"type": "object", "minProperties": 1}
  }
}
