{"contact_search_schedule":{"confirm_force_norm_n":0.7,"confirm_hold_s":0.08,"confirm_normal_n":0.5,"force_fuse_n":50.0,"force_fuse_reason":75,"schema":"step5d.autotune-v4/r009-contact-search-schedule-v1","stages":[{"acceleration_m_s2":0.02,"max_travel_m":0.0035,"name":"far","speed_m_s":0.0008},{"acceleration_m_s2":0.005,"max_travel_m":0.0215,"name":"near","speed_m_s":0.0005}],"timeout_s":10.0,"version":"r009-schedule-v1"},"executable_behavior_config":{"schema":"step5d.autotune-v4/r009-executable-behavior-v1","values":{"cuda_required":true,"degraded_fallback":false,"early_abort":{"audit_filename":"r009-early-abort-audit.jsonl","audit_schema":"step5d.autotune-v4/r009-early-abort-audit-v1","channel":"A","channel_c":{"requires_new_contract":true,"requires_new_fingerprint":true,"requires_new_tp":true,"reuse_hard_stop_channel":false,"status":"future_deferred"},"default_mode":"shadow","enters_gp_training":false,"enters_raw_ledger":false,"guard_fraction":0.1,"kappa_end":1.3,"kappa_midpoint":0.5,"kappa_start":3.0,"kappa_steepness":10.0,"max_audit_bytes":65536,"max_audit_metadata_depth":4,"max_audit_metadata_items":64,"max_audit_metadata_string_chars":256,"max_audit_rows":256,"max_sidecar_bytes":67108864,"minimum_complete_bins":1,"mode_env":"R009_EARLY_ABORT_MODE","objective":{"bin_width_s":0.1,"formal_end_s":60.0,"formal_start_s":5.0,"partial_denominator":"required_bins","partial_open_bin_policy":"exclude_until_bin_end","required_bins":550,"schema":"step5d.force-objective/v2","semantic_fingerprint":"r005.force-mae-v2|stage=25|formal=[5,60)|legacy-shadow=[0,55)|bin=0.1s|bins=550|stat=mean(abs(mean(force_in_bin)-5N))|legacy=shadow-only","statistic":"mean(abs(mean(force_in_bin)-5N))","target_force_n":5.0,"version":"force_mae_v2","window_semantics":"[start,end)"},"resume_schema":"step5d.autotune-v4/r009-early-abort-resume-v1","schema":"step5d.autotune-v4/r009-early-abort-v1","sidecar_filename":"r009-early-abort-shadow.jsonl","sidecar_schema":"step5d.autotune-v4/r009-early-abort-shadow-v1","version":"r009-early-abort-v1"},"host_hz":500.0,"kunwei_hz":500.0,"minimum_rate_hz":460.0,"observability":{"attempt_cap_bytes":2097152,"audit_schema":"step5d.autotune-v4/r009-observability-audit-v1","batch_max_rows":128,"batch_max_wait_s":0.02,"disk_sample_hz":25,"freshness_ttl_formula":"max(3*poll_interval_s,5.0)","hot_path_hz":500,"observer_poll_interval_s":0.2,"queue_max_rows":2048,"retention_s":5.0,"ring_capacity_rows":2500,"run_cap_bytes":536870912,"schema":"step5d.autotune-v4/r009-observability-v1","state20_filename":"r009-state20-observability.jsonl","state25_filename":"r009-state25-observability.jsonl","stop_states":[90],"stop_tail_rows":100,"version":"r009-observability-v1"},"one_inflight_dispatch":true,"path_amplitude_m":0.015,"path_duration_s":60.0,"path_omega_rad_s":0.1,"pending_max":2,"physical_inflight_max":1,"program":"step5d_strict_rnn_autotune_v4_r009","rtde_hz":500.0,"tp_hz":500.0},"version":"r009-behavior-v1"},"lineage":"step5d_strict_rnn_autotune_v4","objective_semantic_fingerprint":"r005.force-mae-v2|stage=25|formal=[5,60)|legacy-shadow=[0,55)|bin=0.1s|bins=550|stat=mean(abs(mean(force_in_bin)-5N))|legacy=shadow-only","parent_r006_contract_sha256":"148433581a07710dd33cedb842f6fe5ced55dc4d61d70fbaa482633b81018551","parent_r006_source_closure_sha256":"05d8993a80c12dee93814489225afcaa505a66624d0100151554d7dbfe615a2d","program":"step5d_strict_rnn_autotune_v4_r009","r009_source_closure_sha256":"a1a2a6e8a173aff4378e417b47b1368cb7fca53ef5414bb7975b067f0d942e5a","raw_codec":"r009raw_v1","runtime_protocol":609009,"schema":"step5d.autotune-v4/r009-behavior-manifest-v1","source_closure":{"files":{"config/schemas/step5d_autotune_v4_r009_behavior_manifest.schema.json":"14ae1b0180a625e339696ad42836c2bc9c850a71bbc890921da08aa5a041761f","config/schemas/step5d_autotune_v4_r009_reason43_runtime_protocol.schema.json":"7c72eb72abfb30b9408bb13475a992070834314a44480127fa4e1839c48087a1","config/schemas/step5d_autotune_v4_r009_release_identity.schema.json":"eefd93b4248aed284b9781dc1bcb41e2d5c1ee2de95e1f86e17272e473ae5c78","tests/test_step5d_autotune_v4_r009_builder.py":"9ac628c144cd27c8222a43a7cac2eb2f86a79b87185d3c68930d1ac22e524f6e","tests/test_step5d_autotune_v4_r009_early_abort.py":"1097e2ad42d280bcf6bcaa05b030f151c84087628911dd093d10d251ab9130e2","tests/test_step5d_autotune_v4_r009_identity_quarantine.py":"eab49feafa215ecd85b0d42d1af55dd138dba2066e097634b0504a74f8c0396d","tests/test_step5d_autotune_v4_r009_observability.py":"fe881b742498373dd37863f52a264b2debbd4b89de46cee4e51ad79c76f450a5","tests/test_step5d_autotune_v4_r009_reason43_runtime_protocol.py":"a1927e8a814703eff8fa5f398729c12c251eeafedf17ba5461d7fe24bf3937dd","tools/build_step5d_autotune_v4_r009.py":"9ca1458dba72777332a4fc2903a950ddb2a4d5030a65af118aace8adb98c2ab9","tools/launch_step5d_autotune_v4_r008_control.py":"5f9328e17e6c31307f2c81e6b2609ba37a9d8ddc5ba6649c620676d254e36752","tools/prepare_step5d_autotune_launch.py":"90d4dedfacc230d766d958518d843c3d4fda83aaf7acee688e9e9a0cfc9d37be","tools/r008_rtde_seq_probe_inject.py":"b2e3bec248be9dfd945f449d441765044a2e2548db7d4c692b5ef2e9d193328c","tools/run_step5d_autotune_campaign.py":"1bc91a0a7e964279d377124abd9593855d5339415aa94aa391bdf02a2198349b","tools/run_step5d_autotune_v4_r008.py":"35a7412f37890e00638d91e695a975c50546272dabfb710a349f8471f24be88d","tools/run_step5d_autotune_v4_r008_b3_two_stage.py":"f20d34041d904c12ab93f53476326673f9e38080a547ac54a41bfb9a8bcde5a1","tools/step5d_autotune_v4_r008/live_adapter.py":"28d4947489f838e9f258867f743dbecbe9d8085088fedd9875b2b97dba210f7b","tools/step5d_autotune_v4_r009/__init__.py":"48f1412f8e0e9dce1c1ad155a37819d174f27d09bf218351a6a80e9935cde057","tools/step5d_autotune_v4_r009/contracts.py":"8ee77eb6f6fbbcff9a1d445f9946bf4f848118b872305ea050a7bea4e971c803","tools/step5d_autotune_v4_r009/diagnostics.py":"25ac9f42816788688dde77973b3359c9bb5805b76c98f6efc152cb0d3f2ee26c","tools/step5d_autotune_v4_r009/early_abort.py":"f4b63d8fe22bfe412013c1262f4f2523aa3d65c877a36847e3a6c39ce9544d3a","tools/step5d_autotune_v4_r009/fake_rtde.py":"8a698d36deb3dcc38e5b9d9f081b7f6422d90d512634de709ea0673b91cc5d05","tools/step5d_autotune_v4_r009/freshness.py":"e93572ecb7868d1132fe66bb12af63e5674095a9c9cc6a43e15fb95a03b8b7cf","tools/step5d_autotune_v4_r009/identity.py":"ec2f2fd184078c03c9d1d4b95ee56bd30ed23d93e720b186d865aa3d6cb88f5f","tools/step5d_autotune_v4_r009/ledger.py":"8fb9c8b264648efcfecb978c3de025a979b42cbe9c0e79746ec85c46bd1c0a30","tools/step5d_autotune_v4_r009/observability.py":"d4f767af777a305d148c6af708da8985ad219b8875ce31c31e178b890c354d63","tools/step5d_autotune_v4_r009/observer.py":"9e069d5b3fc44330109c9cedcd72cff1c4235f7dbeda62899e785f13953ef2f7","tools/step5d_autotune_v4_r009/quarantine.py":"047b677c668f4c143d59a210df717c8a6c44fb6d58dda41c4377fa6bb43c5f6a","tools/step5d_autotune_v4_r009/tp.py":"c1b0301a602e7be62d5c69bf59080d04ffd93a3c239a8128dd350e641cf171de","tools/step5d_autotune_v4_r009/transport.py":"64a32373d78fd19945fa1c1c2e449197eba1251bb77c5af72baa457206213738","tools/step5d_force_objective.py":"5afbc230e999573a64fb0855eedf87e6b0029ef1479bb60a61d3814e40b8ba9b","tools/step5d_machine_campaign_binding.py":"3ab0c60c1e47b064d7d1f293b29278346223b01d71e9179fd234f9f8ebae8ffc"},"schema":"step5d.autotune-v4/r009-source-set-v1","sha256":"a1a2a6e8a173aff4378e417b47b1368cb7fca53ef5414bb7975b067f0d942e5a"},"version":"r009-v1"}
